title,text,type
联想 A720 评测 非同一般 体验 享受,产品 能否 多样化 实际 用户 需求 能否 市场 用户 认可 重要 保证 联想 A720 一体 电脑 开创 家用 一体 电脑 功能化 时代 IDF 展会 上 180 度 推平 设计 全世界 眼光 亮 起来 转轴 之外 27 寸 高清 触摸屏 10 点触 控 非同一般 体验 享受 重要 价格 同样 不算 昂贵 尤其 一体 电脑 佼佼者 苹果 iMac 触摸屏 PC 发展 最 看好 着力点 联想 A720 一体 电脑 显然 捕捉到 商机 27 寸 十点 触摸屏 市面上 不多见 1080P 分辨率 27 寸 iMac 高 家用 显然 再 高 分辨率 只怕 看 上面 内容 不见得 清楚 字 变小 以后 效果 每个 人 接受 27 寸 显示 屏幕 镜面 屏 边框 设置 可触 控 快捷 按键 屏幕 按键 双 触控式 操作 融入 一体 电脑 设计 用户 不同于 平常 操作 体验 A720 iMac 更薄 屏幕 调整 角度 iMac 上 做到 功能 联想 A720 俯仰 角度 可调 范围 很广 度到 180 度 平放 用户 习惯 环境 不同 自由 调节 A720 转轴 理想 效果 平放 状态 一体 电脑 还 体验 触控 游戏 联想 A720 大部分 核心 硬件 配置 底座 当然 接口 设计 底部 底座 右侧 设计 吸入式 光驱 合一 读卡器 左侧 大部分 出风口 设计 USB3.0 HDMI 输出 接口 地面 大部分 接口 设计 音频接口 USB2.0 USB3.0 输入 电视信号 同轴   联想 A720 使 用户 更好 操作 体验 随机 附带 不少 软件 包含 帮助 教育 学习 娱乐 多种 软件 个性 旋转式 支架 设计 不同 软件 体验 下面 介绍 一下 款 产品 应用软件 系统还原 备份 软件 联想 最 基本 随机 软件 用户 遇到 系统 该软件 还原 系统 方便 用户 建议 用户 先 重要 数据 备份 操作 比较简单 触控 一体 电脑 联想 原有 Win7 系统 上 产品 优化 适应 触控 操作 联想 乐 家园 进入 款 软件 包含 关联 娱乐 教育 工具 四个 选项 家庭用户 轻松 触控 操作 完成 日常 应用 需求 IdeaTouch 整合 各项 娱乐 教育软件 一体 软件包 点击 进入 后 仍然 相应 分类 分类 子项 用户 需 点选 操作 即可 deaTouch 左下方 UI 切换 按键 点击 切换 程序 图标 模式 便于 用户 浏览 详细 子程序 信息 款 一体 电脑 转轴 设计 卖点 用户 一体 电脑 放平 简单 双人 对战 游戏 这是 普通 触控 一体 电脑 不能 操作 硬件 配置 上 测试 联想 A720 Intel 第三代 酷 睿智 加速 处理器 i7 3610QM 处理 核心 英特尔 移动 平台 顶配 处理器 22nm 制造 工艺 其核 芯 显卡 升级 HD4000 性能 上 一代 英特尔 酷睿 片器 较大 提升 CPU 测试 部分 CINEBENCH R10 渲染 一张 高精度 3D 场景 画面 测试 处理器 多线程 处理 处理 能力 下面 测试 成绩 i7 3610QM 处理器 移动 版 处理器 最高 得分 新一代 IVB 处理器 性能 表现 值得 肯定 PCamrk Futuremark 较为 全面 基准 测试软件 测试 反映 出 整机 综合性 联想 A720 一体 电脑 PCmark 成绩 9514 分 配备 SSD 固态 硬盘 综合 得分 出色 游戏 娱乐 音乐 表现 上 得分 高 很 适合 家庭 娱乐 联想 A720 一体 电脑 NV GT630M 独立 显卡 款 显卡 NV 早 Femi 架构 主流 GT540M 独显 性能 相当 移动 版 处理器 性能 基本 普通用户 各项 娱乐 需求 3Dmark Vantage 基于 DX10 API 综合性 基准 测试工具 GPU 项 得分 反映 显卡 游戏 能力 联想 A720 一体 电脑 得分 GT630M 一体 电脑 3D 游戏 性能 相对 性能 得分 处于 主流 级别 水平 实际 游戏 测试 帧 数 联想 A720 游戏 性能 主流 GT630M 独立 显卡 产品 低 画质 流畅 运行 市面上 80% 以上 主流 3D 游戏 款 一体 电脑 设计 风格 比较 特殊 核心 元件 设计 底座 之中 整机 发热量 集中 底座 部位 长时间 用户 影响 很大 不 存在 一体 电脑 过热 后会 屏幕 触控 操作 造成 一定 影响 半小时 满 负载 运行 产品 发热量 测试 上 图 配置 高端 i7 四核 处理器 款 产品 机身 发热量 比较 尤其 出风口 附近 热量 较为 明显 堆积 集中 底座 部位 操作者 影响 很 明显 iMac 联想 A720 易用 简单 尤其 功能性 更胜一筹 大部分 配件 安装 底部 降低 维修 拆解 难度 屏幕 轻薄 ° 180 ° 调节 特色 转轴 加上 触摸屏 多种 有趣 变革 尤其 考虑 Windows8 即将 正式 发布 到时候 触摸屏 优势 将近 一步 得到 发挥 硬件 配置 联想 A720 一体 电脑 配备 Ivy Bridge 平台 英特尔 第三代 酷 睿智 处理器 NVIDIA GT600M 系列 高端 独立 显卡 无论是 数据 性能 3D 表现 家庭用户 需求 绝大部分 3D 游戏 流畅 表现 独特 转轴 超大 触摸屏 强劲 配置 iMac 高 价格 简单 方便 应用 设计 联想 A720 中国 家庭用户 桌面上 不可 缺少 产品,3
三星 G7108 强劲 四核 处理器 无缝 多任务处理,三星 GALAXY GRAND G7108 移动 版 中关村 在线 认证 经销商 四川 易讯 通讯 成都 店 处 报价 2100 元 直 板式 设计 配备 英寸 电容 屏 AndroidOS 4.3 操作系统 内置 双 摄像头 WIFI 蓝牙 功能 感兴趣 不妨 下面 商家 联系 三星 G7108 配置 5.25 英寸 高清 屏幕 黄金 视觉 比例 视界 开阔 舒展 多任务处理 欣赏 电影 视频 均 舒适 之享 画质 更趋 优异 缤纷色彩 细致 画面 呈现 动人 视觉 体验 此款 手机 造型 时尚 轻薄 纤巧 舒适 掌握 之余 随身携带 三星 G7108 强劲 四核 处理器 无缝 多任务处理 页面 加载 应用 启动 快捷 流畅 柔软 UI 转换 自如 畅游 感觉 内置 Android ™ 4.3 智能 操作系统 灵敏 触控 体验 简洁 用户界面 各项 操作 得心应手 款 手机 5.25 英寸 HD 屏 1.2 GHz 四核 800 万 像素 移动用户 无需 换 号 享 3G 网络 还 起来 分享,3
红米 Note3 全 网通 版安卓 6.0 内核 系统 内测 组 用户 推送 再次 喊停,小米 MIUI 稳定版 已 日前 正式 全系 小米 红米 手机 推送 更新 红米 Note3 部分 机型 升级 内核 安卓 6.0 部分 用户 很 满意 两天 MIUI 运营 经理 RanGer 风起 微博上 透露 称 红米 Note3 全 网通 版 安卓 6.0 内核 系统 内测 招募 即将 后来 发现 影响 还 进一步 修复 招募 被迫 延期 今天上午 红米 Note3 全 网通 版安卓 6.0 内核 系统 内测 组 用户 推送 没多久 内测 推送 再次 喊停 消息 称 本次 内测 更新 推送 中止 是因为 发现 测试 手动 更新 内测 包会 提示 验证 失败 建议 等待 小米 后续 修复 不要 再次 尝试,3
小米 联通 版 合约 机 骁龙 800 四核 处理器 两年 免费打,下半年 生产厂家 合力 绞杀 发力 市场 上 出现 一大批 小米 叫板 手机 款 小米 联通 版 5.0 英寸 触摸屏 骁龙 800 四核 处理器 1300 万 像素 摄像头 配置 上 毋庸置疑 强机 小米 联通 合约 机在 商家 西部 手机 联盟 至尊 店 报价 2499 元 两年 免费打 喜欢 不妨 关注 小米 机身 正面 配备 5.0 英寸 触摸屏 分辨率 1920 1080p 像素 ppi 到达 441 显示 效果 细腻 硬件 配置 上 小米 史 上 最强 两个 处理器 平台 辅以 2GBRAM 整机 速度 极为 流畅 系统 最新 MIUI V5 系统 丰富 应用软件 还 超敏 触控 技术 实用性 很大 小米 联通 版 处理器 版本 高通 骁龙 800 性能 强大 内存 小米 2S 2GB RAM 机身 存储 16GB 64GB 两种 版本 小米 手机 摄像头 组合 1300 万 像素 主 摄像头 200 万 像素 前置 摄像头 组合 主 摄像头 光圈 f 2.2 配备 飞利浦 双 LED 闪光灯 最高 每秒 拍 10 张 小米 还 NFC 米 Hi Fi 功能,3
曝 小米 手环 国际版 还 加入 NFC 功能 Google Pay,10 消息 Gsmarena 报道 称 内部 人士 透露 小米 手环 1.2 英寸 屏幕 国际版 还 加入 NFC 功能 值得一提的是 小米 手环 小米 华米 一起 研发 2020 第二季度 发布 早 小米 小米 手环 小米 手环 销量 小米 手环 0.95 英寸 AMOLED 显示屏 当时 小米 智能 手环 最 受欢迎 手环 产品 小米 手环 显示屏 显示 丰富 内容 知情 人士 透露 小米 手环 NFC 功能 国际版 还 Google Pay 近几年来 智能 手环 渐渐 穿戴 设备 市场 雄霸一方 Canalys 最新 发布 数据 全球 智能 手环 出货量 持续增长 智能 手环 全球 各地 备受 追捧 智能 手环 竞争 小米 位列 第一 其后 分别 苹果 华为 小米 确实 智能 手环 领域 处于 制霸 地位 出货量 遥遥领先 品牌 小米 智能 手环 成功 在于 价格合理 丰富 可用 功能 监视 心率 监控 睡眠 应用 通知 拨打 电话 小米 手环 还 坚固耐用 上班 通勤 还 ID 卡 公交 卡 支付 工具,3
HTC Hero G3 直 扳 设计 多点 触控 人气,HTC Hero G3 HTC 最 经典 谷歌 Android 机 仅管 上市 一年 时间 Android 手机 依旧 受到 很 高 关注 外形 设计 内在 性能 款 手机 无 语 伦比 优势 当然 价格 很 受 广大 喜爱 北京 市场 报价 2250 元 价格 优惠 兴趣 不妨 关注 一下 外观 HTC Hero G3 直 扳 设计 机身 尾端 上 翘 15 度 形成 下巴 显得 个性 十足 轨迹球 触控 上 灵活 方便 手持 起到 手柄 作用 握感 很 好 3.2 英寸 电容式 显示屏 分辨率 320 480 像素 显示 效果 很 清晰 浏览 网页 播放 视频 很 出色 多点 触控 操作 上 简单 方便 配置 高通 MSM7200A 528MHz 处理器 512MB ROM 288MB RAM 内存 系统 运行 比较 流畅 还 类似 Touch Flo 3D HTC Sense 界面 操作 起来 方便快捷 还 富有 创意 独立 3.5 耳机 接口 音乐 爱好者 便利 插上 耳机 听歌 感觉 真是 太棒了 编辑 点评 G3 外观设计 上 继承 Google 系列 手机 风格 年轻一代 智能手机 用户 人气 卖点 硬件 配置 外 还 在于 Android 开源 操作系统 喜欢 编程 开发软件 高端 玩家 必要 喜欢 联系 商家,3
Nero 软件 新版 发布会 现有 用户 官方网站 下载 免费 更新,距离 微软 全新 一带 操作系统 Windows vista 发布 日期 日益 领进 各大 软件厂商 相继 新一代 应用软件 Vista 今日 数字 媒体 技术 领先 企业 Nero 位于 德国 德国 卡尔斯 巴德 召开 Nero 软件 最新版 发布会 正式 Windows vista Nero7 一套 业界 领先 全方位 多媒体 解决方案 家中 轻松 管理 多媒体 内容 数据 音频 照片 视频 电视 内容 还 输出 移动 设备 随时随地 欣赏 Nero7 还 新增 实用功能 高效 音频 视频 文件传输 移动电话 电视 视频 内容 流式 方法 实时 传输 WindowsXP Media Center Edition PC Xbox 360 视频 游戏 娱乐 系统 Nero 首席 运营官 Udo Eberlein 会上 说 Nero 全新 WindowsVista 操作系统 搭配 用户 数字 生活 体验 感受 效率 获取 快乐 提升 前所未有 高度 不久前 微软 清除 Windows vista BUG Vista 产品 上市 安全 分别 RC1 RC2 阶段 最新 开发 更改 Nero 针对 更改 产品 迅速 调整 官方网站 www nero com 上 兼容 WindowsVista 版本 Nero7 现有 用户 官方网站 下载 免费 更新,3
诺基亚 7.1 高通 骁龙 636 处理器 3060mAh 电池 双卡,北京 时间 10 HMD 伦敦 新品 发布会 上 正式 发布 新款手机 诺基亚 7.1 外观设计 诺基亚 7.1 沿袭 诺基亚 5X 诺基亚 6X 中规中矩 设计 风格 双面 玻璃 金属 中框 无功 无过 刘海 屏 宽 下方 Nokia Logo 看起来 突兀 配色 蓝 灰 两色 可选 硬件 配置 诺基亚 7.1 定位 中端 旗舰机 屏幕 尺寸 5.84 英寸 2280x1080 分辨率 HDR10 标准 环境光 条件 自动 校准 色温 高通 骁龙 636 处理器 存储配置 3GB 4GBRAM 32GB 64GB 存储 3060mAh 电池 400GB Micro SD 卡 扩展 快充 30 分钟 内 充电 50% USB Type C 接口 3.5 耳机 接口 双卡 摄影 拍照 拍照 诺基亚 7.1 1200 万 500 万 像素 后置 双摄 后者 记录 景深 信息 背景 虚化 前置 镜头 800 万 像素 摄影 拍照 HMD 此次 诺基亚 7.1 上 主打 核心技术 产品 售价 诺基亚 7.1 起步价 349 美元 约合 2396 元 10 亚马逊 百思买 渠道 预售 10 28 发货 会上 官方 还 公布 旗下 诺基亚 手机 安卓 9.0 Pie 升级 计划 人 期待 HMD 四款 诺基亚 手机 近期 安卓 9.0 Pie 升级 分别 诺基亚 2018 款 诺基亚 诺基亚 1Plus 诺基亚 X6 诺基亚 诺基亚 8Sirocco HMD 近期 国际版 诺基亚 7Plus 安卓 正式版 更新 国行 版 升级 信息 此次 新 发布 诺基亚 7.1 AndroidOne 设备 HMD 会为 两年 系统升级,3
华为 畅享 10S 麒麟 710F 芯片 续航 强劲,华为 畅享 10S128GB 青岛 经销商 青岛 小超 华为 授权 店 促销 特价 1450 元 联系电话 13953230463 13210168111 13475825111 华为 畅享 10S 背面 双曲面 设计 这种 曲面 弧度 更大 设计 无疑 棱角 突出 机型 贴合 手掌 翡冷翠 幻 夜黑 天空 之境 配色 华为 畅享 10S 外观 色彩 上 旗舰 机型 站 同一 高度 华为 畅享 10S 麒麟 710F 芯片 后置 4800 万 像素 超广角 AI 三 摄像头 配备 4000mAh 电池 6.3 英寸 OLED 屏幕 屏 占 比高 达 90.17% 分辨率 2400 1080 看 大片 玩游戏 影院 级 视听 体验 翡冷翠 幻 夜黑 天空 之境 三种 配色 选 翡冷翠 端庄 内敛 幻 夜黑 神秘 优雅 天空 之境 如梦如幻 每款 配色 耐看 华为 畅享 10S 后置 AI 三 摄像头 一颗 4800 万 像素 超清主 摄像头 一颗 800 万 像素 120 ° 超 广角镜头 一颗 200 万 像素 景深 镜头 可远 可近 轻松 应对 不同 拍照 场景 需求 配备 4000mAh 电池 续航 强劲 轻松 日常 一天 需求 Type C 充电 接口 正反 充电 方便,3
疑 华为 AnscendW3 曝光 WindowsPhone Andriod 双系统 机型,大约 两个 曾 消息 称 华为 首席 营销 官 邵阳 曾称 华为 打算 春季 一部 WindowsPhone Android 双系统 手机 并于 月份 推向 美国市场 后来 华为 否认 消息 春季 已过 机型 并未 现身 一名 包子 玩机 用户 微博中 曝光 一张 疑似 华为 双系统 机型 谍照 早前 华为 曾 华为 AscendW1 W2 WindowsPhone 机型 华为 AscendW3 并未 现身 张谍 怀疑 华为 AnscendW3 机型 从图 看出 底部 按键 微软 Home 键 界面 Android 界面 的确 WindowsPhone Andriod 双系统 机型 消息 华为 否认 近期 双系统 机型 计划 并未 明确 未来 手机 双系统 手机 存在 一定 可能性 无疑 Android WindowsPhone 双系统 手机 相当 一段时间 内会 微软 WindowsPhone 系统 极大 好处 毕竟 Android 装机量 之大 手机 本身 体验 带来不利 影响 双系统 机型 必然 比单 系统 机型 存在 优势 当然 第一款 双系统 手机 诞生 华为 机型 最终 传言,3
荣耀 20 SE 亮相 7nm 制程 麒麟 810,27 花粉 俱乐部 发布 新一轮 花粉 招募 公告 荣耀 20 系列 新 成员 武汉 客厅 文化 博览 中心 亮相 不出意外 新晋 荣耀 潮 时尚 大使 李现 现身 活动 现场 本次 公告 提到 荣耀 20 系列 新 成员 很 曝光 荣耀 20 SE 海外 名称 荣耀 20s 已知 消息 荣耀 20 SE 正面 5.5 英寸 屏幕 合乎 小屏 爱好者 口味 20W 快充 7nm 制程 麒麟 810 荣耀 20 SE 部分 配置 值得注意 荣耀 老熊 曾 26 日晚 发微 博称 选 手机 选 7nm 不久 后 7nm 新 选择 时间 节点 上 看 概率 指 荣耀 20 系列 新 成员 款 荣耀 20 系列 新机 周三 晚 30 亮相 拭目以待,3
新品 红米 小米 1S 移动 4G 版有 升级 红米 定价 仍然 亲民,小米 千元 神器 红米 系列 销量 红米 手机 出货量 已 2500 万台 红米 Note 出货 已 1000 万台 昨日 小米 发布 2015 第一款 新品 红米 产品 仍 售 小米 1S 移动 4G 版有 升级 小编 做 配置 对比 图 一目了然 上 图 看出 红米 小米 1S 4G 版 升级 幅度 很大 处理器 改用 更好 64 位骁龙 410 四核 处理器 前置 摄像头 升至 200 万 像素 新版 红米 还 双卡 双待 TDD FDD 双 4G 网络 下行 速度 更快 150Mbps 红米 1S 移动 版仅 单卡 版 下行 速度 132Mbps 红米 更轻 薄 仅重 133 克 厚度 缩减 9.4 毫米 还 配备 白色 深灰 明黄 浅绿 淡粉 五彩 颜色 亲肤 材质 手感 据称 更好 遗憾 红米 仍 维持 1GB RAM 8GB ROM 配置 屏幕 分辨率 720p 级别 电池 仍 保持 2200 毫安 魅族 最近 发布 魅蓝 note 差距 很 明显 后者 2GB RAM 16GB ROM 1080p 屏 3140 毫安 电池 售价 红米 定价 仍然 亲民 仅售 699 元,3
红米 S2 正面 全高清 5.99 英寸 显示屏 价位 优惠,前段时间 红米 S2 正式 发布 上市 款 手机 各大 渠道 火热 销售 据小编 该款 红米 S2 手机 淘宝 苏宁 易购 官方 旗舰店 报价 499 元 价位 优惠 红米 S2 正面 全高清 5.99 英寸 显示屏 显示 效果 细腻 色彩 还原 精准 超窄 边框 设计 外观 时尚 骁龙 625 处理器 最 顶尖 存在 完全 满足用户 日常 需 32GB 储存 空间 扩展 用户 再也 不用 内存不足 发愁 红米 S2 3GB 运行 内存 32GB 机身 存储 组合 足以 用户 日常 需求 红米 S2 前置 1600 万 像素 后置 1200 500 万 像素 像素 摄像头 组合 拍照 性能 强劲 编辑 点评 红米 S2 画质 上 优秀 表现 用户 体验 完整 美轮美奂 游戏 场景 游戏 体验 提升 无疑 抓住 年轻 用户,3
诺基亚 Lumia 620 特色 捆绑 防护 外壳 出售 具备 IP54 级别 防水 防尘 能力,众所周知 诺基亚 产品 质量 上 一向 出色 芬兰 销售 网站 Gigantti Verkkokauppa 上 出现 配 保护套 版本 诺基亚 Lumia 620 Protected Edition 款 手机 特色 捆绑 防护 外壳 出售 保护 外壳 后 Lumia 620 具备 IP54 级别 防水 防尘 能力 传统 三防 手机 不同 诺基亚 Lumia 620 Protected Edition 三防 能力 基于 防护 外壳 外壳 保护 诺基亚 Lumia 620 具备 IP54 级别 防水 防尘 能力 外壳 去掉 Lumia 620 Protected Edition 普通 Lumia 620 普通 Lumia 620 加上 外壳 具备 三防 能力 款 专用 保护 外壳 三月份 发布 材质 聚碳酸酯 当时 外壳 价格 25 欧元 折合 人民币 205 元 值得一提的是 Lumia 620 Protected Edition 售价 239.9 欧元 折合 人民币 1965 元 Lumia 620 逻辑 版本 价格 199 欧元 折合 人民币 1630 元 三防 与非 三防版 差价 高达 40 欧元 诺基亚 Lumia 620 诺基亚 去年底 入门 级别 WP8 系统 手机 配有 3.8 英寸 触控屏 1GHz 双核 处理器 512MB 内存 8GB 存储容量 配备 500 万 像素 后置 摄像头,3
长虹 Z1 智御 主流 Android2.0 系统 全新 商务 用机,长虹 至今 持久 待机 坚实 耐用 特点 吸引 各路 商务人士 长虹 Z1 主流 Android2.0 系统 全新 商务 用机 一改 往日 T9 键盘 面容 尺寸 触摸式 屏幕 全新 UI 界面 用户 耳目一新 感觉 续航 仍 保障 不必 担心 电量 不足 困扰 商家 尚品 手机网 长虹 Z1 智御 以旧换新 价 1980 元 行货 喜欢 咨询 商家 长虹 Z1 整机 造型 众多 安卓 手机 无太大 区别 长虹 手机 算是 变化 比较 机身 黑色 为主 周围 银色 图条 包裹 屏幕 4.3 英寸 触摸式 屏幕 分辨率 高达 480 800 像素 水准 细腻 度 明显 提升 机身 背面 500 万 像素 摄像头 效果 较为理想 长虹 Z1 一颗 主频 高达 1GHz 处理器 双 512MB ROM RAM 内存 组合 系统 上 安卓 2.0 强力 软件 扩展 大为 提升 编辑 点评 长虹 Z1 说 一部 突破 以往 全新 机型 硬件 几乎 所有 需求 屏幕 爽利 操作 流畅 通话质量 良好 软件 兼容性 极高 几乎 运行 软件 配备 三块 1300mAh 电池 日常 有力 保障 深受 商务人士 关注,3
索 爱将 不 换壳 Xperia Arc S 或出 双核 旗舰级 LT29i,这是 Android 史上 最 好看 机子 常常 有人 评价 索尼 爱立信 Xperia Arc Xperia Arc S 心里 微微 默许 的确 款 机子 完全 发挥 出 索爱 设计 功底 纤薄 不落俗套 优雅 线条 兼具 美感 大气 男生女生 轻易 着迷 Xperia Arc S 强力 索爱 强势 所谓 双核 时代 里 双核 机 索匪 纷纷表示 索爱 造型 不变 基础 上 2012 新款 双核 机 CES 索爱 新机 消息 频出 一周 消息 发现 外形 不变 升级 双核 说法 或许 不 玩笑 索尼 爱立信 德国 公司 最近 公司 CES 展会 Facebook 专题 页面 上 贴 出 一张 广告 图 图中 大姑娘 手里 说 未曾 发布 新机 一眼 看 去 Xperia Arc S 背面 完全 差别 昨日 消息 宣称 索尼 爱立信 CES 发布 两款 新机 敲定 命名 Xperia S Xperia Ion Xperia S 早前 泄漏 出 Xperia Arc HD LT26iNozomi 上 号 Xperia Ion 略显 神秘 爆出 1300 万 像素 换上 SONYLOGO LT28at 半点 关系 称为 传言 LT29i Hayabusa 令人兴奋 图片 看来 机子 正面 Xperia Arc S 完全一致 基本上 定论 索爱 听到 认可 索匪们 呼声 Xperia Arc S 外形 基础 上 双核 配置 机型 旗舰 手机 名字 必定 星级 规格 1.5 GHz 双核 处理器 1G 内存 4.3 英寸 屏幕 720x1 280 分辨率 拍摄 720p 高清 图像 120 万 像素 摄像头 编辑 点评 苹果 不 换壳 苹果 iPhone 4S16G 喷得 一塌糊涂 索 爱将 不 换壳 Xperia Arc S 却会 莫名 兴奋 价格 阵营 有别 不好 说 设计 高下 立判 看得出 人们 确实 看腻 看 圆角 矩形,3
三星 E210S 配备 1.4 GHz 四核 处理器 辅以 2G B超 大运 存,三星 E210S GALAXY SIII 韩版 三星 I9300 存储空间 表现 本身 自带 ROM 内存 32GB 水准 二是 RAM 空间 提升 2GB 过程 更上一层楼 体验 感 手机 中国 推荐 经销商 新卓凡 数码 购机 有礼 处 报价 1788 元 喜欢 不妨 去 一下 外形 三星 E210S GALAXY SIII 普通 版 S3 差别 并不大 机身 厚度 行货 S3 厚 0.4 毫米 LTE 模块 关系 正面 屏幕 尺寸 依旧 4.8 英寸 分辨率 高达 720p 级别 显示 效果 清晰 机身 背面 还 内置 一枚 800 万 像素 高清 镜头 性能 配备 一颗 1.4 GHz 四核 处理器 辅以 2G B超 大运 存 配合 Android4.0 智能 系统 整体 运行 速度 流畅 三星 E210S GALAXY SIII 原版 三星 I9300 出色 内存大小 2GB RAM 速度 流畅 运用 多任务 韩版 还 4G 网络 吸引 人 喜欢 不妨 考虑一下,3
索尼 蓝牙 音箱 SRS X55 2.1 ch 扬声器 系统 内置 58mm 低音炮,索尼 蓝牙 音箱 SRS X55 续航 能力 不容 小觑 还 Bluetooth 4.0 NFC 两种 方式 无线连接 一触 自由 随心 非常适合 外出 自驾 旅行 随身携带 商家 沈阳 索尼 授权 经销商 出售 1009 元 感兴趣 快 购买 索尼 SRS X55 配色 黑白 蓝红 四色 选 体验 白色 X55 X55 正 长方体 大小 bose soundlinkmini 差不多 顶部 塑料 两侧 金属 带 出门 很 方便 重量 不算 重 单手 提起 说走就走 背面 插口 设置 上 X55 配有 15V 直流 输入 micro USB 充电 接口 audio in 接口 标准 USB 接口 供给 智能手机 充电 复位 按键 外出 数天 远门 携带 1X55 带 标配 充电器 索尼 SRS X55 2.1 ch 扬声器 系统 内置 58mm 低音炮 输出功率 可达 30W 低音 表现 好 震撼 其高 品质音乐 体验 背后 自然 离不开 索尼 多项 高音质 技术 助力 X55 索尼 S Master 数字 放大器 技术 DSEE 数字 增强 技术 LDAC 高音质 无线 传输技术 ClearAudio 醇音 技术 配备 SOUND 按钮 一键 即可 享受 分离 扬声器 般的 宽广 声场 立体 音效 编辑 点评 索尼 SRS X55 特别 外层 隔板 设计 上 树脂 纤维 材质 电路板 四层 玻璃 环氧树脂 使 讯号 声波 传递 损失 降低 大大增加 声音 表现 空间感 打造 清晰 具 通透 感 音质 前方 低音 扬声器 两个 全 音域 扬声器 后方 配置 双 被动式 振幅 器 慑魄 低音 音乐 体验,3
华为 Y310S 单核 1GHz 处理器 系统 内存 512MB,华为 Y310S 价格 实惠 且性 智能手机 喜欢 商品 福建省 宁德市 蕉城区 坪 塔路 禾 兴楼 号楼 401 室 商家 详谈 华为 Y310S 英寸 3G 智能手机 单核 1GHz 处理器 系统 内存 512MB 运行 日常 软件 已 后置 一颗 200W 像素 摄像头 主打 性价比 产品 已 价格 相对 便宜 售价 不足 400 元 喜欢 商家 处 商家 详谈,3
诺基亚 C5 05 一颗 600MHz ARM11 处理器 系统 稳定,曾经 红极一时 诺基亚 品牌 相信 陌生 诺基亚 手机 人 第一印象 结实 耐用 没错 Android 手机 横行 时代 也许 诺基亚 手机 功能 最多 人们 心中 地位 很 高 诺基亚 C5 05 针对 普通用户 超值 智能手机 低廉 价格 稳定 系统 优势 经销商 深圳市 中诚 电器 有限公司 处该 手机 国行 报价 710 元 喜欢 入手 外观 诺基亚 C5 05 熟悉 诺基亚 C5 03 之间 变化 正面 3.3 英寸 TFT 材质 显示屏 背面 一枚 200 万 像素 摄像头 基本 日常 款 手机 还 内置 FW 收音机 电子书 功能 大大 丰富 业余生活 硬件 配置 诺基亚 C5 05 一颗 600MHz ARM11 处理器 128MB 运行 内存 基本操作 流畅 系统 机 延用 经典 S60v5 操作系统 软件 兼容性 好 系统 稳定,3
闻尚 i1 联发科 MT6577 配备 1.0 GHz 双核 处理器,最近 国内 手机 厂商 闻尚 公司 5.8 英寸 大屏 双核 安卓 手机 型号 i1 手机 同级 机 当中 少见 模拟 电视 手势 控制 功能 外 还 具备 较具 竞争力 价格 商家 报价 仅 980 元 兴趣 不妨 关注 5.8 英寸 屏幕 i1 最 重要 卖点 成本 原因 屏幕 分辨率 停留 800x480 级别 材质 仅 普通 TFT 摄像头 手机 前置 130 万 像素 后置 500 万 像素 插值 800 万 像素 配备 一颗 LED 补 光灯 i1 双卡 双待 功能 用户 联通 3G 网络 千元 高性价比 双核 安卓 手机 闻尚 i1 联发科 MT6577 平台 解决方案 配备 1.0 GHz 双核 处理器 手机 RAM 1GB ROM 8GB 储存卡 扩展 整体 性能 相当,3
