title,text,type
步步高 vivo E1 联发科 MT6573 处理器 整机 综合 表现,步步高 vivoE1 时尚 机身 配合 均衡 配置 综合 表现 很 出色 结合 双卡 双模 功能 低 售价 性价比 手机 值得 考虑 步步高 vivo E1 出色 视觉 操控 体验 双卡 双待 着实 方便 款 手机 商家 保定 盛世 通 手机 专卖 有售 商家 报价 690 元 感兴趣 不妨 咨询 商家 步步高 vivo E1 外形 设计 简约 时尚 流畅 线条 配合 靓丽 机身 彰显 个性 正面 3.2 英寸 TFT 屏幕 分辨率 480x320 像素 视觉 感受 性能 联发科 MT6573 处理器 配合 512MB RAM 运行 速度 出色 应对 市面 主流 游戏 步步高 vivo E1 还 搭配 AndroidOS2.3 智能 操作系统 兼容性 更好 可玩性 更高 整机 综合 表现 编辑 点评 步步高 vivo E1 双卡 双模 高性价 3G 智能机 时尚 大方 外观设计 搭配 Android OS 2.3 智能 操作系统 可玩性 性 大幅 提升 款 手机 商家 保定 盛世 通 手机 专卖 有售 商家 报价 仅 690 元 感兴趣 不妨 咨询 商家 喜欢 双卡 双待 手机 不要 错过机会 小编 留言 购买 提到 IT 搜购 网会 得到 优惠,3
爆料 称 索尼 C6603 高通 1.5 GHz 四核 处理器,传闻 显示 索尼 2013 Android 市场 一场 超级 战役 明年 发布 四款 强机 大神 爆料 便是 吋 屏幕 旗舰 机型 C6603 此次 这位 大神 爆料 出 一部分 参数 还 奉 上 真机 图片 据称 索尼 型号 C6603 iPhone 4S 玻璃 机身 设计 爆料 图上 看出 仍 索尼 机型 一贯 日系 外观 四周 棱角分明 时尚 大神 还 爆料 称 配备 吋 1080P 触控屏 高通 1.5 GHz 四核 处理器 2GB RAM 配置 防水 防尘 设计 1300 万 像素 摄像头 增加 Cyber shot 高级 自动 模式 HDR 硬件 摄录 功能 电池容量 3000mAh 运行 Android 4.2 操作系统,3
32GB 小米 手机 2S 配备 骁龙 600 处理器 3G 智能 四核 手机,2014 18 32GB 小米 手机 2S 今日 商家 心意 3C 数码 处 报出 1550 元 全新 报价 配件 电池 充电器 数据线 官方 标配 32GB 小米 手机 2S 配备 骁龙 600 处理器 3G 智能 四核 手机 32GB 小米 手机 2S 正面 4.3 英寸 IPS 原色 硬屏 分辨率 1280X720 像素 HD 级别 多点 触控 显示 效果 较为 清晰 核心 处 还 配备 一颗 全新 1.7 GHz 骁龙 600 系列 四核 处理器 2GBRAM 32GB ROM 发烧级 内存 组合 机身 背部 配备 1300 万 像素 堆栈 式 镜头 包含 LED 补 光灯 前置 镜头 200 万 像素 编辑 点评 32GB 小米 手机 2S 整体 上 给力 32GB ROM 超大 容量 放 视频 游戏 影音 娱乐 表现 很 得体 本机 还 摄像头 升级 1300 万 像素 拍照 效果 出众 32GB 小米 手机 2S 最新 促销价 仅为 1599 元 买 不必 预约 不必 哄抢 感兴趣 关注 一下,3
三星 X488 手机 国内 畅销 莫过于 三点,三星 X488 手机 再续 经典 继 X468 三星 X488 手机 市场 风云变幻 竞争 激烈 尤其 中端 市场 一向 必争之地 2004 三星 陆续 超值 性价比 系列 手机 深得 消费者 喜爱 三星 中低端 市场 抢回 不少 份额 国内 畅销 莫过于 三点 在于 造型 设计 精致 巧妙 在于 功能齐全 其三 在于 售价 不高 众多 三星 手机 当中 彩蛋 造型 算是 最为 深入 民心 设计 T108 首创 彩蛋 设计 今天 看来 新颖别致 三星 去年底 市场 几款 彩蛋 造型 手机 D488 E338 再 一次 掀起 彩蛋 手机 热潮 如今 X488 手机 三星 经典 设计 精湛 工艺 近乎 完美 流线型 贝壳 曲线 角度 欣赏 令人 喜爱 万分 握 手里 更让人 爱不释手 X488 手机 处处 严丝合缝 体现 三星 一贯 优良 做工 外壳 特殊 处理 防止 机身 表面 留下 手指 痕迹 还 外观 平添 几分 高雅 气息 使 X488 有意无意 之间 细节 处 显露 高贵 出身 再次 说 说 新款 三星 X488 功能 三星 手机 屏幕 铃声 出色 表现 赢得 消费者 青睐 128 160 像素 65536 色 UFB 屏幕 YAMAHA4 和弦 JAVAMIDP 2.0 MMS 中低端 市场 其声 其色 始终保持 强势 地位 X488 实用功能 保持 细腻 屏幕 优美 和弦 之外 X488 菜单 图标 比之其 前辈 明显 改善 X488 菜单 模式 改用 主流 九宫格 菜单 模式 生动 人性化 机身 200 条 短信 容量 相信 需求 X488 上 出现 丰富 表情符号 功能 方便 亲朋好友 生动 形象 沟通 彩信 添加 图片 铃声 录音 经由 GPRS 发送 X488 彩信 容量 可储存 100 条 受到 总共 1400KB 存储空间 限制 X488 电话本 功能 维持 三星 一贯 水准 名片 式 电话本 每个 名单 可储存 手机号码 家庭 电话 电子邮件 信息 X488 电话本 容量 2000 高端 商务 机 容量 数值 令 评测 人员 感到 惊讶 X488 还 最 十组 电话 群组 75 克 体重 无论是 握 手中 放入 包内 亦 挂 胸前 宛若 无物 体现 别致 心情 系出名门 轻巧 别致 功能齐全 价格 却 不到 二千 低价 不 低质 X488 再续 经典 必定 中低端 市场 大放异彩,3
华为 U8661 外观 小巧 时尚 高通 骁龙 MSM7225A 处理器,华为 U8661 外观 小巧 时尚 硬件 配置 主流 系统优化 下下足 功夫 深度 定制 精美 炫彩 3D 界面 要用 爽 还要 炫 突显 个性 中国联通 定制 发售 结合 人性化 套餐 优惠 华为 U8661 尽显 实惠 优势 华为 U8661 不失为 时尚 小巧 智能 入门 机型 想 IT 产品报价 行情 请 关注 PConline 河北 站 产品 外观 上 华为 U8661 沿用 经典 直板 造型 机身 小巧 正面 背部 衔接 紧密 背壳 部分 磨砂 材质 防滑 性 很 好 搭配 不大不小 机身 尺寸 手中 握持 感 好 机身 正面 3.5 英寸 时尚 大屏 TFT 材质 480x320 像素 分辨率 主屏 色彩 26 万色 感应 灵敏 显示 效果 尚可 机身 尺寸 116.3 60.5 11.9 重量 120g 方便 携带 配置 性能 来讲 华为 U8661 高通 骁龙 MSM7225A 处理器 Android 2.3 智能 操作系统 搭配 256MB RAM 512MB ROM 机身 内存 TF 卡 microSD 卡 系统 运行 空间 蓝牙 WIFI 重力 感应 距离 感应 光线 感应 功能 联通 定制 WCDMA 网络 制式 内置 320 万 像素 摄像头 带 CMOS 传感器 2048 1536 分辨率 照片 拍摄 有声 视频 拍摄 日常 华为 U8661 联通 定制 机型 GSM 网络 联通 3G 高速 WCDMA 网络 双卡 双待 尽享 3G 时代 极速 互联 体验 华为 U8661 屏幕 尺寸 3.5 英寸 电容 屏 显示 分辨率 HVGA 级别 可视 角度 比较 外形 时尚 小巧 硬件 配置 中规中矩 主打 入门 智能机 市场 喜欢 千万 不要 错过,3
摩托罗拉 A810 内建多 媒体播放器 FM 收音机 功能 掌中 音乐 机,A810 简约 设计 风格 性能 配置 强大 手写 识别 功能 全面 娱乐 功能 Linux 强大 扩展 能力 A810 世人 瞩目 款 手机 报价 仅 1180 元 值得 入手 简洁 时尚 直板 设计 摩托罗拉 A810 重量 100g 105 51 14mm 三围 大小 全 机 材质 除去 电池 盖 部分 金属 以外 均 ABS 工程塑料 主材 灯光 反射 外观 激光 印压 三角形 暗纹 素净 白色 上 暗纹 点缀 手机 几分 动感 总体 上 说 做工 细致 功能 配置 A810 2.2 英寸 26 万色 QVGA 分辨率 TFT 触摸屏 机身 后 一枚 200 万 像素 摄像头 A810 还 内 建多 媒体播放器 FM 收音机 功能 立体声 蓝牙 功能 3.5 毫米 耳机 接口 款 手机 显示 效果 色彩 靓丽 屏幕 表现力 好 还原 能力 自然 不 突兀 待机 屏幕 上 MOTOfans 熟悉 Linux 系统 标准 桌面 视频 A810 MP4 3GP H.263 格式 播放 视频 播放器 同样 简约 操作 方便 屏幕显示 细腻 播放 效果 比较 人 满意 款 摩托罗拉 A810 手机 全 触摸 智能手机 同样 用户 想到 内存 不仅仅 依靠 本机 自带 内存 还 microSD 存储卡 扩展 2GB 容量 用户 放心 手机 互传 资源 售价 1180 元,3
诺基亚 定制 版本 Lumia 521 五月份 运营商 处开 卖,诺基亚 MWC 移动 世界 大会 上 发布 低端 WP8 手机 Lumia 520 值得 一体 美国 运营商 T Mobile 定制 版本 Lumia 521 五月份 运营商 处开 卖 售价 预计 240 美元 左右 款 诺基亚 新机 定位 低端 绝对 物有所值 英寸 IPS LCD 超 灵敏 显示屏 480 800 分辨率 1GHz 双核 处理器 512MBRAM 8G 内存 Micro SD 扩展 500 像素 摄像头 720P 摄像 1430 毫安 电池 整体 配置 已 低端 水平 T Mobile 消息 Lumia521 将会 五月 沃尔玛 微软 商店 T Mobile 商店 上市 还 具体 上市 日期 价格 信息 预计 Lumia521 非 合约 版本 大概 240 美元 左右,3
索爱 U5i Symbian S60V5 系统 智能 触控 手机,商家 丰泽 数码 处 索爱 U5i 欧版 最新 报价 780 元 标准配置 一电 一充 音乐 耳机 数据线 说明书 购买 即可 保护膜 硅胶套 手机 挂绳 价值 100 元 礼品 二选 A 原装 电池 充电器 B 蓝牙 耳机 索爱 U5i Symbian S60V5 系统 智能 触控 手机 外观 造型 索尼 爱立信 U5i 直板 外形 设计 机身 正面 配备 3.2 英寸 分辨率 360 640 像素 TFT 屏幕 显示 效果 清晰 细腻 加入 圆弧形 元素 辅以 钢琴 烤 漆 工艺 涂层 高贵 索尼 爱立信 U5i 设计 加入 最新 人体 曲线 设计 理念 视觉效果 出色 系统 塞班 第五版 操作系统 扩展 性能 强大 机身 背部 一枚 810 万 像素 摄像头 笑脸 模式 人像 对焦 自定义 焦点 功能 拍照 表现 专业 索爱 U5i 纵观 整体 性能 流线型 机身 高像素 摄像头 高清 视频 拍摄 功能 突出 特点 不足 800 售价 性价比 相当 高 追求 时尚 外观 追求 价格 手机 不 容错过 感兴趣 不妨 关注 一下,3
新 MacBook Boot Camp 安装 Windows 不,苹果 BootCamp 文档 苹果 最近 发布 MacBookAir 13 寸 RetinaMacBookPro 不再 BootCamp 运行 Windows7 系统 最新 MacBook 上 BootCamp 只能 运行 Windows8 更新 操作系统 BootCamp 安装 Windows7 不 不 熟悉 BootCamp 这是 苹果 设计 微软 Windows Mac 电脑 上 安装 软件 早 2013 款 MacPro BootCamp 不 安装 Windows7 2014 款 MacBookAir 2014 款 MacBookPro 唯一 还 Window7 Mac 电脑 BootCamp 不 Windows7 Mac 用户 仍然 虚拟机 软件 VMwareFusion 安装 Windows7 苹果 不再 Windows7 不 奇怪 系统 发布 时间 很长 Windows7 2009 发布 随后 微软 2012 发布 Windows8 六岁 Windows7 仍然 份额 最高 Windows 操作系统 苹果 决定 MacPro 不再 Windows7 Mac 用户 不能 接受 Windows 用户 价格 界面 迟迟 接受 Windows8 全新 Windows10 晚些时候 发布 新 系统 Windows7 Windows8 设计 元素 融合 起来 不同 用户 喜好 Windows10 价格 还 公布 Windows7 8.1 用户 免费 升级,3
黑莓 8800 内存 64MB 32 和弦 铃音,黑莓 8800 内存 64MB BlackberryOS 系统 直板 造型 配有 2.4 英寸 显示屏 显示 效果 清晰 运行 迅速 流畅 蓝牙 WIFI GPS 功能 很 齐全 还 电子邮件 收发 现 沈阳 三好 街 报价 仅为 500 元 农民 价位 实惠 值得 考虑 外观 黑莓 8800 黑色 主体 四周 镶嵌 金属 条 外壳 搭配 14mm 厚度 极具 商务 气息 QWERTY 键盘 配置 26 万色 2.4 英寸 QVGA 240 320 分辨率 横向 屏幕 显示 效果 不俗 最具 特点 导航 部分 夜光 效果 圆形 球 反应 灵敏 手感 机身 标准 2.5 耳机 接口 miniUSB 数据 接口 功能 黑莓 8800 32 和弦 铃音 MP3 MIDI 格式 铃音 理论 通话时间 300 分钟 理论 待机时间 528 小时 3GP MPEG 格式 视频 播放 MP3 AAC AAC AMR 格式 音频 播放 内置 游戏 功能 蓝牙 功能 内置 GPS 蓝牙 2.0 micro SD 卡 扩展 黑莓 8800 任务 消息 电话本 选项 无 限制 保存 保证 资料 永远 丢失 Word Excel PowerPoint 文档 浏览 PDF 文件 浏览 办公 功能齐全 黑莓 8800 智能 商务 手机 浓愈 商务 气息 Word Excel PowerPoint 文档 浏览 办公 功能 很 齐全 价位 低廉 商务人士 优先 考虑 现 沈阳 三好 街 报价 500 元 感兴趣 商家 取得联系,3
京东 商城 以旧换新 服务 换 新款 iPad Pro 千万 不 容错过,前不久 令 翘首以盼 新款 iPad Pro MacBook Air 悄然 上架 苹果 官网 增加 摄像头 处理器 升级 A12Z 浴霸 双摄 重要 全新 妙控 键盘 iPad Pro 新 姿势 一时间 刷屏 朋友圈 令 不少 手持 旧款 iPad 果粉 心动不已 Apple 新品 已 京东 上线 新款 iPad Pro 25 正式 发售 MacBook Air 火热 预约 新品 一站式 以旧换新 服务 最高 享 1000 元 额外 购机 补贴 部分 区域 最快 小时 极速 换 新 上门服务 帮 省钱 省心 京东 Apple 产品 自营 旗舰店 一站式 以旧换新 服务 成为 用户 首选 借势 苹果 新款 iPad Pro MacBook Air 上市 京东 一站式 以旧换新 服务 再 升级 一站式 以旧换新 最快 两 小时 极速 达 部分 区域 用户 最快 下单 两个 小时 内 足不出户 拿到 新款 iPad Pro 第一 时间 尝鲜 新品 具体来说 京东 商城 苹果 新品 以旧换新 服务 爆款 新品 一站式 以旧换新 100% 旧机款 抵扣 新机 款 回收 再购 新 最高 补贴 1000 元 补贴 力度 大大 高于 行业 平均水平 旧机 估值 使 旧机 价值 得到 极大 提高 惠及 广大 消费者 针对 服务 估值 低 过程 麻烦 卖 旧机 买 新机 脱节 安全性 堪忧 痛点 京东 打破 原有 以旧换新 流程 首创 性 树立 行业 标杆 级 用户 体验 针对 服务 京东 100% 旧机款 抵扣 新机 款 交由 专业 工程师 检测 换新取 旧 同步 完成 还 增值 服务 免费 贴膜 数据 迁移 隐私 清除 贴心 服务 不再 卖 旧机 担惊受怕 举个 例子 一台 旧 iPad Pro 256GB 版 参与 京东 一站式 以旧换新 服务 估值 5500 元 左右 再 加上 额外 1000 元 补贴 购买 新款 iPad Pro 11 英寸 256GB 版 仅 需 7029 6500 元 仅 需 支付 529 元 享受 最新 苹果 新品 iPad Pro 11 英寸 256GB 版 说 划算 相信 小伙伴 不 清楚 以旧换新 规则 具体来说 此次 活动 基本 不 限 品类 品牌 品牌 旧 手机 旧电脑 旧 平板 回收 新款 iPad Pro 旧款 华为 三星 手机 平板 更换 程度 帮 用户 变 旧 为宝 该项 服务 仅 局限 部分 已 开通 城市 商城 默认 收集 登陆 网站 GPS 收货 地址 信息 安排 质检 工程师 相关 服务 后续 继续 拓展 区域 总体 换 新款 iPad Pro 千万 不 容错过 一站式 以旧换新 服务 或许 暗藏 家里 吃 灰 旧 手机 旧 平板 旧 相机 很 值钱 前往 京东 以旧换新 旧机 估值 抵扣 额外 最高 再 补贴 1000 元 或许 iPad Pro 最近 距离 还 不 赶快 行动 起来 机不可失 文中 数据 仅供参考 具体 详见 页面 活动 规则,3
苹果 开启 教育 优惠 注意 新学期 优惠 每人 人 仅限 一次,昨日 晚间 苹果 中国 官方 开启 暑期 教育 优惠 活动 期间 教师 学生 优惠 价格 购买 苹果 产品 购买 指定 Mac 产品 iPad 产品 赠送 Beats 耳机 苹果 官网 显示 优惠活动 期间 购买 任意 符合条件 Mac iPad 享受 优惠价格 一副 Beats 耳机 AppleCare 服务 计划 指定 配件 服务 教育 优惠 折扣 Beats 耳机 市场 价值 2200 元 左右 相当于 购买 Mac 变相 便宜 两千元 超值 苹果 昨日 还 更新 MacBook Air 13 英寸 入门级 MacBook Pro MacBook Air 加入 原彩 显示 技术 售价 调低 8899 元 学生 8099 元 优惠价格 购买 值得注意 苹果公司 是否 购买 资格 验证 在线 Apple Store 零售店 要求 用户 相关 学 学生 教职员工 员 证件 线上 购买 要求 电子邮件发送 证件 副本 扫描 件 高校学生 父母 购买 订单 收件人 必须 子女 注意 新学期 优惠 每人 人 仅限 一次,3
苹果 首款 自主 开发 Android 应用 Move to iOS 评分 却 令人震惊,北京 时间 17 消息 科技 博客 VentureBeat 报道 苹果 今天 首款 自主 开发 Android 应用 Move to iOS Move to iOS 大量 星 评分 却 令人震惊 苹果 Move to iOS 应用 Google Play 平均 评分 1.8 星 接近 79% 用户 给予 星 评分 给予 星 评分 接近 19% 发布 不到 24 小时 Move to iOS 遭到 Android 用户 恶评 此次 应用 评分 看出 Android 用户 iOS 多么 憎恨 一位 名为 罗伯特 克斯克 Robert Kirsch Android 用户 评论 写道 宁死 不用 封闭 受 控制 系统 苹果 几年 内 成为 黑莓 款 应用 活该 花 得到 少 苹果 绝不会 允许 应用 商店 出现 这种 应用 谷歌 太 宽容 事实上 确实 苹果 App Store 规定 谷歌 应用 商店 类似 应用 带有 移动 平台 名称 应用 或元 数据 拒绝 苹果 App Store 规则 中称 事件 暴露 明显 谷歌 评论者 平台 允许 想 写 写 苹果 App Store Google Play 允许 用户 下载 应用 后 立即 评价 应用 容易 导致用户 顺手 给予 星 评分 谷歌 苹果 较为简单 解决 用户 作出 应用 评价 要求 必须 得用 上 几分钟 具体 多长时间 取决于 应用 类型 限制 分钟 时间 不合理 星 评分 大大减少 角度 讲 星 评分 不 真实,3
iTunes Connect 已 更新 将会 iOS 应用 自动 启用,苹果 iTunesConnect 网页 应用 放出 新 设计 版本 新 设计 外观 上 iOS 靠拢 更是 iCloud 网站 版面 类似 新 设计 开发者 应用 新 iTunesConnect 功能 将会 iOS 应用 自动 启用 增加 分析 功能 用户 更好 追踪 AppStore 页面 访问量 并不需要 开发者 导入 苹果 发布 iTunesConnect 说 iTunesConnect 网页 查看 改进 后 开发者 系统 iTunesConnect 里 管理 创建 所有 应用 应用 命名 添加 缩略图 添加 描述 文字 指定 价格 操作 AppStore iTunesConnect 基于 Web 工具 用户 AppleID 登录 iPhoneDeveloperProgram 后 页面 右侧 连接 进入 iTunesConnect 界面 用户 管理 银行帐号 应用 版本 维护,3
华硕 P8H61 M LX 主板 全新 B3 版 H61 芯片组 性能 出色,华硕 P8H61 M LX 主板 延续 一线 大厂 优良 品质 出色 主板 款 显卡 价格 实惠 亲民 主板 商家 处 最新 报价 裸机 价为 399 元 套餐 价为 2699 元 转机 用户 考虑一下 华硕 P8H61 M LX 主板 全新 B3 版 H61 芯片组 酷睿 i3 i5 i72000 系列 处理器 Sandy Bridge 架构 处理器 优秀 3D 性能 华硕 P8H61 M LE 主板 GPU BOOST 技术 还 轻松 GPU 性能 提升 30% 游戏 流畅 EPU 智能 节能 处理器 自动检测 系统 负载 实时 智能 调整 功率 做到 功耗 节能 两不误 供电 华硕 P8H61 M LX 主板 针对 Sandy Bridge 架构 特点 相 供电 设计 相 单独 核心 供电 相 分别 显示 核心 内存 控制器 独立 供电 结合 EPU 智能 节能 处理器 处理器 稳定 供电 有效 降低 无谓 损耗 内存 华硕 P8H61 M LX 主板 条 DIMM 内存 插槽 DDR3 内存 HTPC 用户 内存 插槽 数量 磁盘 华硕 P8H61 M LX 主板 SATA2 磁盘 接口 全新 B3 版 H61 芯片组 完全 解决 老 版本 芯片组 SATA 接口 隐患 集成 Realtek ALC887 声道 音频芯片 Realtek RTL8111E 千兆 以太网卡 扩展 华硕 P8H61 M LX 主板 条 PCI E x16 插槽 条 PCI E x1 插槽 方便 用户 扩展 独立 显卡 I O 接口 华硕 P8H61 M LX 主板 PS2 键鼠 两用 接口 USB2.0 接口 VGA 视频 输出 接口 打印机接口 音频 RJ45 网络接口 套餐 华硕 H61 主板 intel 三代 22 纳米 G1610 双核 2.6 G 主频 2M 三缓 金士顿 4G 1600 500G 硬盘 华硕 机箱 400W 电源 AOC19 寸 显示器 罗技 套件 2699 元 主板 用料 做工 严谨 价格 实惠 亲民 低量 不 低价 性能 出色 需求 用户 赶快 行动,3
海信 阅读 手机 A5C 29 正式 京东 发售 供 墨玉 黑 汉玉白 两种 机身 颜色,28 海信 手机 官微 海信 阅读 手机 A5C 明天 29 正式 京东 发售 据悉 海信 阅读 手机 A5C 价格 1699 元 64GB 29 日开 抢 提前 预约 还 可享 A5C 专属 焕彩 保护套 京东 读书 VIP 季卡 会员 福利 海信 阅读 手机 A5C 全球 首款 彩色 水墨 屏 手机 5.84 英寸 护眼 彩墨屏 显示 4096 色彩 保持 超 低能耗 不 自主 发光 全反射 外界 光让 眼睛 感知 色彩 普通 彩屏 柔和 温润 翻阅 一本 纸质 画册 用户 阅读 纯 文本 电子书籍 还 读到 绘本 艺术 画集 图解 类书籍 内容 涵盖 京东 读书 掌阅 QQ 阅读 咪咕 阅读 人民 阅读 五大 内容 平台 全网 海量 阅读 资源 规格 提骁龙 439 处理器 64GB 存储 组合 4000mAh 电池 连续 阅读 62 93 小时 厚度 8.1 机身 重 158g 供 墨玉 黑 汉玉白 两种 机身 颜色,3
艾利和 E200 仅售 499 元 立体声 效果 饱满 通透性 大增,27 E200 E150 E 系列 高端 产品 4GB 仅售 499 元 喜欢 去 文末 经销商 咨询 E200 液晶屏幕 2.8 英寸 320 240 26 万色 TFT LCD 尤其 增加 RM RMVB 视频格式 分辨率 达 400 300 保持 鲜艳 醒目 色彩 度 E200 真机 手中 手感 舍弃 工程塑料 外壳 设计 换成 全 铝质 金属 机身 设计 紧凑 轻薄 机身 尺寸 55.6 105.0 10.0 重量 94.1 g 音质 上 E200 继续 iriver 优势 格式 MP3 WMA OGG ASF FLAC 内置 SRS WOW HD 系统 预设 EQ 用户 自定义 EQ 耳机 功率 却 提高 19mW 立体声 效果 饱满 通透性 大增,3
